SCHOOL,DISTRICT,CODE,NAME,ENG,NEP,MATH,SCI,SOC,HPE,TOTAL,SAP,DIST,FIRST,SEC,THIRD,PASS,FAIL,PASS.PERCENT
1723,KAVREPALANC,27107,GYANJYOTI BOARDING SCHOOL NALA,66,68,8,53,73,58,6,6,0,6,0,0,6,0,100
266,JHAPA,4113,GYANJYOTI MA VI CHANDRAGADI,34,49,3,29,41,41,34,34,0,7,7,0,14,20,41
4572,BANKE,67039,GYANJYOTI MA VI CHAPARGAUNDHI KOHALPUR,24,39,24,26,33,40,191,191,0,7,41,6,54,136,28
180,JHAPA,4026,GYANJYOTI MA VI GAURADAHA,41,54,54,42,55,51,39,39,2,19,10,0,31,8,79
3258,KASKI,41162,GYANJYOTI VIDYAKUNJ MA VI LEKHNATH-13,52,49,48,26,55,51,17,17,0,5,10,0,15,2,88
290,JHAPA,4137,GYANKUNJ ACADEMY MA VI GAURIGANJ,56,55,63,44,66,56,18,18,0,16,1,0,17,1,94
1397,SARLAHI,22040,GYANKUNJ SECONDARY BOARDING SCHOOL MALA,49,61,56,44,58,47,13,13,0,8,4,0,12,1,92
2481,LALITPUR,32094,GYANKUNJA ENGLISH SCHOOL LAGANKHEL,5,57,71,41,47,56,42,41,1,35,5,0,41,0,100
1984,KATHMANDU,29163,GYANKUNJA MA VI RABIBHAWAN,64,61,79,51,57,60,74,72,24,46,2,0,72,0,100
2984,GORKHA,38023,GYANMARGA MA VI GHYALCHOWK,31,53,38,25,42,49,58,58,0,3,29,0,32,26,55
278,JHAPA,4125,GYANODAYA AAWASIYA MA VI GAURIGANJ-5,29,51,48,37,6,49,12,12,0,5,3,0,8,4,67
1391,SARLAHI,22034,GYANODAYA AWASIYA MA VI MALANGWA,49,50,66,43,47,45,34,34,0,16,17,0,33,1,97
2648,MAKWANPUR,33048,GYANODAYA BAL BATIKA ACADEMY MA VI SANGAM,6,56,82,48,60,56,30,30,5,20,4,0,29,1,97
2617,MAKWANPUR,33017,GYANODAYA BAL BATIKA AWASIYA MA VI KANTIRAJ,52,54,72,41,58,56,22,22,3,9,7,0,19,3,86
2431,LALITPUR,32042,GYANODAYA BAL BATIKA MA VI SANEPA,60,60,81,54,53,61,207,207,24,180,2,0,206,1,100
3164,KASKI,41067,GYANODAYA MA VI BAIDAM,62,62,63,42,57,58,3,3,0,2,1,0,3,0,100
4086,BAGLUNG,52073,GYANODAYA MA VI BOBANG,20,37,3,3,39,43,65,65,0,0,15,2,17,48,26
3825,RUPANDEHI,48040,GYANODAYA MA VI BUTWAL,30,35,20,20,46,37,20,20,0,3,2,1,6,14,30
702,SUNSARI,10039,GYANODAYA MA VI DHARAN,25,40,27,29,41,35,100,100,0,3,22,7,32,68,32
140,ILAM,3053,GYANODAYA MA VI JOGMAI,26,39,23,30,44,37,34,34,0,1,7,0,8,26,24
3640,PALPA,45075,GYANODAYA MA VI KACHAL OKHALDHUNGA,31,51,41,3,40,61,4,4,0,1,3,0,4,0,100
4573,BANKE,67040,GYANODAYA MA VI KHAJURABAJAR,34,60,39,3,48,37,128,126,0,24,65,1,90,35,71
3971,MUSTANG,50004,GYANODAYA MA VI LETE,32,47,37,29,41,50,14,14,0,2,8,1,11,3,79
3509,NAWALPARASI,44041,GYANODAYA MA VI PARSAUNI,2,45,26,24,41,51,89,89,0,4,22,3,29,60,33
1854,KATHMANDU,29027,GYANODAYA MA VI PURANO KALIMATI,51,65,79,39,55,49,118,118,2,97,17,0,116,2,98
4397,KALIKOT,62011,GYANODAYA MA VI RAMNAKOT,22,32,21,12,36,35,20,19,0,0,2,0,2,17,11
3061,LAMJUNG,40026,GYANODAYA MA VI SAHILITAR,31,5,34,34,41,5,35,35,0,2,17,0,19,16,54
3655,GULMI,46008,GYANODAYA MA VI TURANG MAJUWA,26,50,32,29,40,42,90,90,0,6,30,4,40,50,44
3818,RUPANDEHI,48033,GYANODAYA RATRI MA VI BUTWAL,27,3,21,21,47,4,18,18,0,1,4,1,6,12,33
741,SUNSARI,10079,GYANODAYA SECONDARY ENGLISH BOARDING SC,56,5,67,55,72,56,22,22,1,20,1,0,22,0,100
3549,NAWALPARASI,44083,GYANODAYA SECONDARY SCHOOL KAWASOTI,30,47,42,27,55,50,61,61,0,8,26,0,34,27,56
223,JHAPA,4069,GYANODAYA SHIKSHYA NIKETAN MA VI DHULABARI,34,55,35,40,56,42,15,15,0,2,8,0,10,5,67
4587,BANKE,67055,GYANODAYA VIDYA NIKETAN ENGLISH MEDIUM SC,5,53,26,38,48,38,15,15,0,2,7,0,9,6,60
661,MORANG,9168,GYANODAYA VIDYA NIKETAN MA VI HAMILI TOL,6,55,88,63,8,65,5,5,3,2,0,0,5,0,100
2064,KATHMANDU,29250,GYANPUNJA SECONDARY BOARDING SCHOOL NEW,6,58,8,46,50,48,39,39,4,32,3,0,39,0,100
3184,KASKI,41087,GYANU BABA SECONDARY BOARDING SCHOOL BA,0,47,67,48,64,56,23,23,1,18,4,0,23,0,100
1724,KAVREPALANC,27108,GYNA KUNJ SECONDARY SCHOOL JANAGAL,64,60,83,46,57,67,15,15,3,12,0,0,15,0,100
195,JHAPA,4041,HALDIBARI MA VI HALDIBARI,16,40,26,24,44,34,114,114,0,4,15,2,21,93,18
1101,DOLAKHA,17022,HALESHWAR MA VI SURI TINEKHU,26,47,42,28,46,47,54,54,0,8,24,2,34,20,63
3311,TANAHUN,42045,HANSA BAHINI MA VI EAKLEKHET,30,5,34,26,40,51,66,66,0,8,20,0,28,38,42
1649,KAVREPALANC,27033,HANUMAN MA VI PATLEKHET,28,45,42,3,4,41,54,54,0,1,29,4,34,20,63
1036,SIRAHA,16021,HANUMAN PRASAD SHARADA MA VI INARWA,2,36,14,24,32,43,43,43,0,0,3,0,3,40,7
1091,DOLAKHA,17012,HANUMANTESHWAR MA VI KABRE,40,64,65,42,5,4,100,100,3,41,43,0,87,13,87
1305,DHANUSHA,20085,HAPPY LAND ENGLISH BOARDING SCHOOL JANAKP,42,4,30,27,39,42,12,12,0,0,5,1,6,6,50
991,SAPTARI,15037,HAPPY LAND MA VI RAJBIRAJ,56,56,56,41,61,48,126,126,1,90,29,0,120,6,95
4291,DANG,58016,HAPUR MA VI NIDHUWAR,2,36,11,17,20,29,41,40,0,2,2,0,4,36,10
3721,GULMI,46075,HARACHOUR MA VI HARACHOUR,21,47,21,19,42,42,36,36,0,0,5,1,6,30,17
3802,RUPANDEHI,48017,HARAIYA MA VI HARAIYA,31,49,35,28,42,48,81,81,0,8,36,0,44,37,54
2083,KATHMANDU,29269,HARATI ENGLISH MA VI CHIBAHAL THAMEL,57,52,54,36,46,48,12,12,0,3,3,0,6,6,50
4074,BAGLUNG,52059,HARI MA VI IDI HILA,29,38,18,21,29,40,40,40,0,0,5,0,5,35,13
4762,DOTI,72029,HARIHAR MA VI PACHANALI TALKOT,22,4,22,19,29,32,13,13,0,0,3,0,3,10,23
3744,ARGHAKHANCH,47012,HARIHAR SAN TATHA SADHARAN MA VI KHIDIM,19,42,3,24,41,48,62,62,0,2,18,1,21,41,34
234,JHAPA,4080,HARIKUL MODEL HIGH SCHOOL SURUNGA-5,57,56,66,48,55,52,48,48,2,40,6,0,48,0,100
666,SUNSARI,10002,HARINAGARA MA VI HARINAGARA,22,33,21,22,46,28,84,84,0,1,14,7,22,62,26
2460,LALITPUR,32072,HARISIDDHI MA VI HARISIDDHI,42,49,50,28,43,38,50,50,1,10,19,3,33,17,66
878,OKHALDHUNGA,13017,HARKAPUR MA VI HARKAPUR,13,33,14,21,37,4,64,64,0,0,2,0,2,62,3
3664,GULMI,46017,HARMICHOUR MA VI HARMICHOUR,19,33,26,20,33,38,58,43,0,5,17,0,22,21,51
3133,KASKI,41036,HARPANKOT MA VI KUDAWI DANDA,18,39,14,2,31,39,20,20,0,1,0,0,1,19,5
3872,RUPANDEHI,48089,HAZI AINYATULLAH MA VI SEMRAHNA GONAHA,23,27,19,17,36,33,64,61,0,0,9,2,11,50,18
2344,KATHMANDU,29547,HEARTLAND CHILDREN ACADEMY TAHACHAL ALKA,55,61,7,40,51,52,10,10,0,9,1,0,10,0,100
2342,KATHMANDU,29545,HEBRON PUBLIC SCHOOL KOTESHWOR,59,54,61,34,47,45,15,14,0,8,5,0,13,1,93
3984,MYAGDI,51008,HEM MA VI SIWANG TAKAM,2,41,18,25,41,42,39,39,0,1,4,0,5,34,13
3933,KAPILVASTU,49014,HEM RAJ MA VI HATHAUSA,44,43,5,42,56,46,60,60,0,23,30,0,53,7,88
2595,LALITPUR,32215,HERITAGE ENGLISH BOARDING SCHOOL TIKATHALI,54,62,78,53,55,52,7,7,0,7,0,0,7,0,100
3149,KASKI,41052,HERMANN GMEINER MA VI RAMBAZAR,66,62,76,58,70,58,58,58,14,43,1,0,58,0,100
3174,KASKI,41077,HERMANN GMEINER MA VI TASHILING,55,50,44,35,53,53,56,56,0,22,27,0,49,7,88
2655,MAKWANPUR,33056,HETAUDA ACADEMY HETAUDA MAKAWANPUR,64,55,73,48,49,57,45,45,3,32,7,0,42,3,93
2661,MAKWANPUR,33064,HETAUDA MODERN ENGLISH SECONDARY SCHOOL,56,55,70,34,58,44,18,18,1,9,4,0,14,4,78
2563,LALITPUR,32181,HIGH VIEW ENGLISH SECONDARY SCHOOL TIKATH,61,59,66,5,56,54,13,13,1,10,2,0,13,0,100
1725,KAVREPALANC,27109,HIGHLAND ENGLISH SECONDARY BOARDING SCHO,6,55,77,38,54,61,5,5,0,5,0,0,5,0,100
2349,KATHMANDU,29554,HILARY HIGH SCHOOL GAURINAGAR,60,62,80,43,56,46,16,16,3,12,1,0,16,0,100
430,DHANKUTA,7036,HILE MA VI HILE,18,35,18,22,43,32,48,48,0,2,5,1,8,39,17
1094,DOLAKHA,17015,HILEPANI SAN MA VI HILEPANI LAMIDANDA,17,40,26,3,4,34,75,74,0,0,9,1,10,64,14
2696,CHITWAN,34028,HILL BIRD AWASIYA MA VI BHARATPUR,51,55,62,39,60,56,73,73,8,33,23,0,64,9,88
3178,KASKI,41081,HILL POINT HIGH SCHOOL MATEPANI,58,51,81,45,59,59,55,55,5,50,0,0,55,0,100
3232,KASKI,41136,HILL SIDE ENGLISH BOARDING SCHOOL SALYAN NA,50,60,56,36,5,6,5,5,0,2,2,0,4,1,80
2584,LALITPUR,32203,HILL SIDE ENGLISH SCHOOL GOTIKHEL,66,63,60,41,57,49,7,7,0,4,3,0,7,0,100
2454,LALITPUR,32065,HILL TOP ENGLISH SECONDARY SCHOOL CHAPAGA,56,53,71,41,56,5,42,42,5,25,12,0,42,0,100
2044,KATHMANDU,29230,HILL TOWN INTERNATIONAL SCHOOL KIRTIPUR,56,53,71,4,43,42,35,35,0,24,11,0,35,0,100
877,OKHALDHUNGA,13016,HIM GANGA MA VI RAWADOLU,31,55,42,36,48,38,32,32,0,5,22,1,28,4,88
2270,KATHMANDU,29470,HIM RASHMI HIGH SCHOOL MANAMAIJU DANDAGAU,64,73,86,43,56,54,17,17,1,15,1,0,17,0,100
765,SUNSARI,10104,HIM SHIKHAR ENGLISH SCHOOL TARAHARA,52,59,59,5,68,58,9,9,0,9,0,0,9,0,100
773,SOLUKHUMBU,11005,HIMAL DARSAN MA VI NECHA,14,43,21,24,57,37,56,56,0,2,4,0,6,50,11
663,MORANG,9170,HIMALAYA BALSANSAR ENGLISH BOARDING SCHO,0,56,6,53,58,56,8,8,0,8,0,0,8,0,100
2051,KATHMANDU,29237,HIMALAYA ENGLISH BOARDING SCHOOL KOTESHW,63,61,79,48,60,59,30,30,3,26,0,0,29,1,97
1072,SIRAHA,16058,HIMALAYA ENGLISH BOARDING SCHOOL MIRCHAIY,50,57,43,46,69,59,7,7,0,6,0,0,6,1,86
2077,KATHMANDU,29263,HIMALAYA INTERNATIONAL MODEL SCHOOL MAHA,6.27,61,78,51,51,53,49,49,1,48,0,0,49,0,100
4185,RUKUM,54029,HIMALAYA JANATA MA VI NUWAKOTDANDA,26,4,12,3,36,37,81,81,0,0,3,0,3,78,4
345,SANKHUWASAB,5023,HIMALAYA MA VI AALA,22,37,15,25,38,46,31,31,0,0,2,0,2,29,6
1663,KAVREPALANC,27047,HIMALAYA MA VI BANEPA,21,4,34,27,35,40,44,44,0,2,7,1,10,34,23
2992,GORKHA,38031,HIMALAYA MA VI BARPAK,33,44,26,20,42,45,33,33,0,1,8,0,9,24,27
779,SOLUKHUMBU,11011,HIMALAYA MA VI BASAKHASTAP,25,50,22,33,51,45,12,12,0,0,4,0,4,8,33
3652,GULMI,46005,HIMALAYA MA VI BASTU DHURKOT,23,46,20,29,43,49,82,80,0,3,13,0,16,64,20
2709,CHITWAN,34041,HIMALAYA MA VI CHAMPANAGAR,40,4,54,32,45,49,47,47,0,13,26,1,40,7,85
3336,TANAHUN,42074,HIMALAYA MA VI CHAMPE BAGAINCHA,33,45,3,38,5,50,32,32,0,2,10,0,12,20,38
4489,SURKHET,66012,HIMALAYA MA VI CHOLPA,16,44,8,13,28,39,44,44,0,0,3,0,3,41,7
4445,DAILEKH,65007,HIMALAYA MA VI DADIMADI,23,45,1,22,5,45,14,14,0,0,0,0,0,14,000
194,JHAPA,4040,HIMALAYA MA VI DAMAK,23,42,21,32,43,35,183,183,0,14,24,3,41,142,22
4789,KAILALI,73014,HIMALAYA MA VI GHIYAPUCHHARI,18,36,24,21,3,29,69,69,0,0,9,1,10,59,14
3142,KASKI,41045,HIMALAYA MA VI GORJE,24,40,33,20,40,44,32,32,0,1,8,0,9,23,28
116,ILAM,3026,HIMALAYA MA VI GORKHEY,22,38,13,26,40,35,61,61,0,0,0,1,1,60,2
3678,GULMI,46031,HIMALAYA MA VI HASTICHAUR,19,46,39,29,38,34,51,51,0,0,11,2,13,38,25
343,SANKHUWASAB,5021,HIMALAYA MA VI HEDANGANA,23,4,27,31,37,35,20,20,0,0,1,4,5,15,25
4871,DARCHULA,74004,HIMALAYA MA VI HUTI,11,37,13,17,27,32,44,44,0,0,2,0,2,42,5
2971,GORKHA,38010,HIMALAYA MA VI JHYANWA SIMJUNG,23,44,25,24,4,33,43,42,0,2,7,0,9,33,21
799,SOLUKHUMBU,11032,HIMALAYA MA VI JUBU LUHARE,20,41,13,2,48,31,27,27,0,0,4,1,5,22,19
4708,ACHHAM,71014,HIMALAYA MA VI KHALSAIN,20,4,24,22,38,34,110,109,0,2,14,3,19,90,17
323,SANKHUWASAB,5001,HIMALAYA MA VI KHANDBARI,3,52,40,35,55,52,110,110,1,22,58,2,83,27,75
4164,RUKUM,54008,HIMALAYA MA VI KHOLAGAON,29,45,18,28,31,36,85,85,0,6,12,0,18,67,21
1102,DOLAKHA,17023,HIMALAYA MA VI KHOPACHAGU,18,39,19,26,43,34,19,19,0,0,5,0,5,14,26
4120,PARBAT,53030,HIMALAYA MA VI KHURKOT BAGAICHA,28,42,40,24,48,40,48,48,0,7,23,0,30,18,63
4169,RUKUM,54013,HIMALAYA MA VI KINDA,20,35,8,19,36,29,29,29,0,0,0,0,0,29,000
3317,TANAHUN,42051,HIMALAYA MA VI KOKHE BHANUMATI,19,4,25,21,39,46,55,54,0,0,12,0,12,42,22
3079,LAMJUNG,40044,HIMALAYA MA VI KOLKI,31,39,41,24,32,38,9,9,0,0,3,3,6,3,67
3134,KASKI,41037,HIMALAYA MA VI MAUJA,25,4,2,17,37,43,17,17,0,0,2,0,2,15,12
1882,KATHMANDU,29057,HIMALAYA MA VI NEWROAD,59,61,72,34,52,39,19,19,0,13,2,0,15,4,79
865,OKHALDHUNGA,13004,HIMALAYA MA VI NISANKHE,19,34,22,32,40,31,120,120,0,3,19,3,25,95,21
3003,GORKHA,38042,HIMALAYA MA VI SAURPANI,34,50,28,24,39,44,37,37,0,0,16,1,17,20,46
1713,KAVREPALANC,27097,HIMALAYA MA VI SIPALI CHILAUNE,23,43,23,25,34,39,49,49,0,2,9,3,14,35,29
3408,SYANGJA,43044,HIMALAYA MA VI TAKSAR,37,58,48,3,40,43,11,11,0,3,5,0,8,3,73
3210,KASKI,41114,HIMALAYA MA VI TIRLUNG TOLKA,15,45,1,21,32,47,10,10,0,0,2,0,2,8,20
1844,KATHMANDU,29017,HIMALAYA VIDYAMANDIR AWASIYA MA VI SIPHAL,63,55,79,37,52,55,47,47,2,37,5,0,44,3,94
2663,MAKWANPUR,33066,HIMALAYAN BOARDING,63,62,83,49,6,48,7,7,0,5,2,0,7,0,100
252,JHAPA,4099,HIMALAYAN ENGLISH ACADEMY BAHUNDANGI,26,5,36,2,49,32,21,21,0,3,3,1,7,14,33
2738,CHITWAN,34070,HIMALAYAN ENGLISH BOARDING SCHOOL RATNAN,53,55,75,54,69,59,36,36,4,30,2,0,36,0,100
3409,SYANGJA,43045,HIMALAYAN ENGLISH BOARDING SCHOOL SYANGJ,0,45,54,41,5,46,24,24,0,6,15,0,21,3,88
2566,LALITPUR,32184,HIMALAYAN INTERNATIONAL IDEAL SCHOOL JAWAL,59,53,86,47,5,54,5,5,0,5,0,0,5,0,100
3224,KASKI,41128,HIMALAYAN MILAN MA VI NAMARJUNG,32,39,32,21,40,38,24,24,0,0,9,0,9,15,38
2927,PARSA,37028,HIMALAYAN SECONDARY SCHOOL SHREEPUR,53,49,57,34,48,45,39,39,2,13,11,0,26,13,67
1306,DHANUSHA,20086,HIMALI BOARDINGH SCHOOL JANAKPURDHAM 11,54,60,73,34,55,52,10,10,0,8,2,0,10,0,100
158,JHAPA,4004,HIMALI MA VI PRITHIVINAGAR,26,43,22,29,52,33,68,68,0,3,12,4,19,49,28
3418,SYANGJA,43054,HIMALI MA VI RATNEDOVAN ELADI,20,42,24,20,4,33,29,28,0,0,8,0,8,20,29
3116,KASKI,41018,HIMANCHAL BOARDING SCHOOL POKHARA,59,56,87,50,55,57,40,40,2,36,2,0,40,0,100
3999,MYAGDI,51023,HIMANCHAL MA VI NAGI,3,5,33,36,48,48,24,24,0,4,10,0,14,10,58
775,SOLUKHUMBU,11007,HIMGANGA MA VI CHAUNLAKHARKA,14,37,12,27,47,41,69,69,0,0,3,0,3,66,4
1126,RAMECHHAP,18003,HIMGANGA MA VI SANGHUNTAR,17,40,3,25,43,34,68,68,0,5,11,0,16,52,24
4359,HUMLA,59003,HIMJYOTI MA VI SARKEGAD,24,46,15,2,31,37,13,13,0,0,2,0,2,11,15
2298,KATHMANDU,29499,HIMSHIKHAR BOARDING SCHOOL,63,73,9,59,62,56,8,8,3,5,0,0,8,0,100
4413,JUMLA,63009,HIMSHIKHAR MA VI TATAPANI,4,50,2,20,31,38,24,24,0,0,5,2,7,17,29
2290,KATHMANDU,29491,HIMSHRINKHALA ACADEMY SCHOOL NAYAPATI,60,7,88,51,63,57,27,27,6,20,1,0,27,0,100
2453,LALITPUR,32064,HINDU VIDYAPEETH MA VI BALKUMARI,63,60,8,51,57,50,20,20,4,16,0,0,20,0,100
4332,DANG,58057,HINDU VIDYAPEETH NEPAL GHORAHI,58,54,54,5,50,45,17,17,1,10,5,0,16,1,94
2075,KATHMANDU,29261,HINDU VIDYAPEETH NEPAL INDRAYANI,52,69,78,49,57,56,17,17,2,13,2,0,17,0,100
989,SAPTARI,15035,HIRA PHEKANI MA VI BANAWOLA,17,40,11,21,38,31,47,47,0,1,1,0,2,45,4
2884,BARA,36051,HOLY ANGELS SECONDARY BOARDING SCHOOL NI,57,51,67,47,74,49,14,13,0,13,0,0,13,0,100
84,PANCHTHAR,2051,HOLY CHILD ENGLISH SECONDARY SCHOOL RABI,23,38,19,26,44,3,26,26,0,0,1,0,1,25,4
1289,DHANUSHA,20067,HOLY CROSS HIGH SCHOOL JANAKPURDHAM,39,55,46,27,45,46,47,47,1,14,11,1,27,20,57
5049,KANCHANPUR,77061,HOLY FAMILY ENGLISH MEDIUM SCHOOL TILKENI,62,6,60,39,56,51,5,5,0,3,1,0,4,1,80
1940,KATHMANDU,29117,HOLY GARDEN BOARDING HIGH SCHOOL RINGROA,62,67,85,40,65,57,41,41,9,30,0,0,39,2,95
1822,BHAKTAPUR,28098,HOLY GARDEN ENGLISH SCHOOL BYASI-10,62,63,85,44,63,51,16,16,2,14,0,0,16,0,100
4592,BANKE,67061,HOLY LAND ENGLISH HIGH SCHOOL NEPALGUNJ,42,42,3,27,29,28,9,9,0,0,3,0,3,6,33
2934,PARSA,37035,HOLY LAND ENGLISH SECONDARY SCHOOL SHREE,52,51,8,39,48,42,17,17,0,11,5,0,16,1,94
1972,KATHMANDU,29150,HOLY LAND INTERNATIONAL MA VI NEW BANESHW,61,51,75,4,58,57,185,185,14,139,15,0,168,17,91
757,SUNSARI,10096,HOLY LAND INTERNATIONAL SCHOOL DHARAN-15,51,54,60,5,66,49,4,4,0,4,0,0,4,0,100
2887,BARA,36054,HOLY RAJ ENGLISH SCHOOL JEETPUR,4,6,7,5,6,4,1,1,0,1,0,0,1,0,100
2585,LALITPUR,32204,HOLY TEMPLE SECONDARY SCHOOL CHHAMPI-2,70,77,84,52,65,58,5,5,2,3,0,0,5,0,100
2095,KATHMANDU,29282,HOLY VISION MA VI TAHACHAL,58,56,91,49,57,52,59,59,11,46,2,0,59,0,100
2777,CHITWAN,34118,HOLY VISION PUBLIC SCHOOL BHARATPUR-5,64,62,75,49,56,55,15,15,4,7,2,0,13,2,87
3286,TANAHUN,42020,HOM RAJ LOHANI SHARADA SHIKSHYA SADAN MA V,26,42,41,28,41,44,51,50,0,5,19,2,26,24,52
2043,KATHMANDU,29229,HOME LAND SERVICE MA VI LAINCHOUR,32,43,19,21,31,35,15,15,0,0,2,4,6,9,40
3952,KAPILVASTU,49033,HORIZON ENGLISH AWASIYA MA VI GAJEHADA-7 SI,66,60,76,57,73,56,33,33,11,22,0,0,33,0,100
4875,DARCHULA,74008,HUNAINATH MA VI KUNI,18,46,18,18,32,3,35,35,0,0,5,0,5,30,14
4873,DARCHULA,74006,HUNAINATH MA VI RATAMATA,24,44,2,15,34,4,31,31,0,0,4,2,6,25,19
4884,DARCHULA,74017,HUSKAR MA VI KATAI,19,47,35,22,27,37,30,30,0,0,6,0,6,24,20
2507,LALITPUR,32123,I J PIONEER MA VI MAHALAXMISTHAN,63,68,85,54,64,57,27,27,11,16,0,0,27,0,100
1412,SARLAHI,22056,IDEAL CO-ED ACADEMY LALBANDI-9,68,62,77,52,66,52,14,14,1,13,0,0,14,0,100
3863,RUPANDEHI,48080,IDEAL ENGLISH BOARDING SCHOOL DEEPNAGAR B,62,47,56,37,52,5,25,25,2,13,6,0,21,4,84
2276,KATHMANDU,29477,IDEAL ENGLISH SCHOOL MAIJUBAHAL,61,65,79,47,5,51,61,61,6,50,2,0,58,3,95
2474,LALITPUR,32086,IDEAL MODEL SCHOOL JAWALAKHEL,63,6,71,40,58,54,66,66,6,50,8,0,64,2,97
4341,DANG,58068,IDEAL SECONDARY ENGLISH BOARDING SCHOOL T,61,60,63,52,6,53,17,17,0,15,2,0,17,0,100
2334,KATHMANDU,29536,IKEDA INTERNATIONAL SCHOOL RABIBHAWAN,60,68,64,4,54,47,6,6,0,6,0,0,6,0,100
136,ILAM,3049,ILAM VIDYA MANDIR MA VI NARAYANSTHAN,36,61,5,37,55,42,61,61,0,20,32,0,52,9,85
723,SUNSARI,10060,INARUWA ENGLISH BOARDING SCHOOL INARUWA,55,59,6,52,60,51,60,60,3,48,9,0,60,0,100
4752,DOTI,72019,INDRA MA VI DUMRAKOT,2,39,2,2,26,29,27,27,0,0,2,1,3,24,11
1990,KATHMANDU,29169,INDRADHANUSH BOARDING HIGH SCHOOL BHIMSE,60,6,86,45,42,5,35,35,5,29,0,0,34,1,97
50,PANCHTHAR,2014,INDRANI MA VI MOUWA,12,40,17,21,40,3,110,108,0,0,5,0,5,103,5
642,MORANG,9147,INDRAPUR NAMUNA MA VI INDRAPUR-4,36,47,44,44,44,49,25,24,0,6,16,0,22,2,92
75,PANCHTHAR,2041,INDRAWATI MA VI HANGUM,15,37,16,18,35,29,29,29,0,0,0,0,0,29,000
2362,KATHMANDU,29568,INDRAWATI PUBLIC SCHOOL MAIJUBAHAL,58,70,61,36,45,58,11,11,0,5,0,0,5,6,45
2654,MAKWANPUR,33054,INDRAYANI MA VI AGRA,20,41,29,17,34,38,23,23,0,0,3,1,4,19,17
4518,SURKHET,66043,INDRENI MA VI GOGANE,16,41,12,7,27,39,5,5,0,0,0,0,0,5,000
2509,LALITPUR,32125,INDRENI SECONDARY ENGLISH SCHOOL THECHO,62,66,90,48,66,52,25,25,6,19,0,0,25,0,100
1444,SINDHUPALCH,23023,INDRESWAR MA VI MELAMCHI,25,42,4,27,39,37,125,124,0,6,41,5,52,72,42
1630,KAVREPALANC,27014,INDRESWAR MA VI PANAUTI,30,49,41,30,39,38,81,81,0,12,34,5,51,30,63
2350,KATHMANDU,29556,INTELLECTUAL ACADEMY KUMARIGAL,63,6,6,42,41,3,4,4,0,1,3,0,4,0,100
2015,KATHMANDU,29198,INTENSIVE INTERNATIONAL ACADEMY MARU BHIMS,57,57,78,51,50,5,31,31,2,24,5,0,31,0,100
2759,CHITWAN,34092,INTERNATIONAL ENGLISH MODEL SCHOOL PARSA,36,54,5,35,47,50,46,46,0,10,20,0,30,16,65
5028,KANCHANPUR,77039,INTERNATIONAL PUBLIC SCHOOL MAHENDRANAGA,57,59,70,44,56,56,86,86,3,70,10,0,83,3,97
3047,LAMJUNG,40012,ISHANESHWAR UCHCHA MA VI BHORLETAR,36,56,43,21,46,49,63,63,0,5,23,0,28,35,44
987,SAPTARI,15033,ISHWARI HIYA SURAIT JILEWI JANATA MA VI SARSH,23,47,22,31,5,4,19,19,0,0,5,0,5,14,26
3667,GULMI,46020,ISHWARI MA VI CHARPALADARBAR DEVISTHAN,24,38,17,27,4,42,78,76,0,5,13,1,19,56,25
1386,SARLAHI,22029,ISHWARPUR BELA MA VI RAMNAGAR MANAHARWA,29,51,36,27,44,38,56,56,0,1,31,4,36,20,64
751,SUNSARI,10090,ITAHARI MODEL SCHOOL ITAHARI,52,55,58,43,53,49,34,33,1,21,11,0,33,0,100
760,SUNSARI,10099,ITAHARI RESIDENTIAL MA VI ITAHARI-4,29,54,46,3,54,45,38,38,0,6,19,0,25,13,66
72,PANCHTHAR,2037,ITHUNG MA VI RANITAR,19,4,20,2,43,26,53,53,0,0,3,3,6,47,11
1519,NUWAKOT,25029,J D BOARDING SCHOOL DEVIGHAT,53,57,75,48,62,6,46,46,10,24,5,0,39,7,85
1061,SIRAHA,16046,J M ACADEMY SIRAHA 1,4,47,47,31,41,44,38,38,0,11,15,1,27,11,71
4922,BAITADI,75020,JABALPUR MA VI SAILODA,25,40,38,3,35,3,9,9,0,0,2,3,5,4,56
4614,BARDIA,68021,JAGADAMBA MA VI MADHEILA,33,4,34,28,44,37,54,54,0,7,18,3,28,26,52
4931,BAITADI,75029,JAGADAMBA MA VI RANIBUNGA,34,45,48,3,41,41,27,27,0,1,20,1,22,5,81
4464,DAILEKH,65026,JAGADISH MA VI AIRADI,26,39,17,30,35,30,11,11,0,0,1,1,2,9,18
692,SUNSARI,10028,JAGANNATH DED RAJ JANATA MA VI KALABANJAR,13,41,21,24,42,30,184,184,0,3,13,3,19,165,10
4492,SURKHET,66015,JAGANNATH MA VI BIJAURA,38,50,46,32,44,44,9,9,0,2,5,1,8,1,89
2018,KATHMANDU,29201,JAGANNATH MA VI JAGANNATH DEWAL,5,55,52,50,66,53,5,5,0,4,1,0,5,0,100
3474,NAWALPARASI,44006,JAGANNATH MA VI RAMNAGAR,30,43,24,28,52,38,83,83,0,8,17,2,27,56,33
4369,MUGU,60003,JAGAT MALA MA VI DHAIN,31,47,20,24,4,30,5,5,0,0,0,0,0,5,000
2032,KATHMANDU,29216,JAGAT MANDIR AWASIYA MA VI LAMPOKHARI CHAB,61,63,79,47,45,46,38,38,2,32,4,0,38,0,100
979,SAPTARI,15025,JAGESHWAR GARAHAI JANATA MA VI SEHARA,22,41,19,27,41,32,66,66,0,0,9,1,10,56,15
3009,GORKHA,38049,JAGESHWOR MA VI BORLANG,35,55,46,31,49,52,25,25,0,4,16,0,20,5,80
1674,KAVREPALANC,27058,JAGRITI MA VI CHAURI KAURENI,16,39,21,22,24,36,40,40,0,1,2,0,3,37,8
1752,BHAKTAPUR,28027,JAGRITI MA VI KHAUMA,34,50,36,27,44,50,29,29,0,2,11,0,13,16,45
1232,DHANUSHA,20009,JAGRUP SAHA RAMPUKAR SAHA MA VI PARSURAM,18,25,23,15,23,22,45,45,0,1,3,0,4,41,9
77,PANCHTHAR,2043,JALA SINGH MA VI PAUWA SARTAP,26,42,36,25,39,40,20,20,0,1,9,1,11,9,55
2483,LALITPUR,32096,JALAPA MA VI DHAPAKHEL,32,58,44,27,44,4,36,36,0,7,14,0,21,15,58
821,KHOTANG,12018,JALAPA MA VI JALAPA,36,43,31,35,36,35,62,62,0,0,28,10,38,24,61
4669,BAJHANG,70012,JALAPA MA VI RITHAPATA DEWAL,40,54,39,35,53,49,45,45,0,9,25,0,34,11,76
3358,TANAHUN,42101,JALDEVI MA VI BHADGAUN VYAS,37,47,28,31,48,49,42,42,0,4,15,0,19,23,45
1359,SARLAHI,22002,JALDHAR KAMALDEV MA VI BRAHMAPURI,22,42,34,22,37,31,31,31,0,2,4,3,9,22,29
2037,KATHMANDU,29221,JALJALA SHISHU SADAN MA VI NARDEVI,63,62,78,51,50,44,34,34,2,30,2,0,34,0,100
3002,GORKHA,38041,JALKANYA DEVI MA VI TAKU LAKURIBOAT,33,50,19,19,35,43,23,23,0,0,4,0,4,19,17
419,DHANKUTA,7025,JALKANYA MA VI BENSITOLE KHUWAPHOK-5,16,51,10,23,38,35,15,15,0,0,1,0,1,14,7
1203,SINDHULI,19032,JALKANYA MA VI CHAPAULI,32,44,38,28,35,37,37,36,0,2,19,3,24,12,67
1434,SINDHUPALCH,23013,JALPA DEVI MA VI BAHUNIPATI,30,4,50,38,47,45,95,95,0,13,50,8,71,24,75
4701,ACHHAM,71007,JALPA DEVI MA VI DHANKU,16,41,19,19,34,34,75,74,0,1,3,3,7,67,9
401,DHANKUTA,7007,JALPA DEVI MA VI PAKHRIBAS,16,4,16,19,38,31,99,99,1,2,3,0,6,93,6
481,BHOJPUR,8031,JALPA MA VI CHAUKIDANDA,22,51,16,33,46,3,32,32,0,0,1,0,1,31,3
1438,SINDHUPALCH,23017,JALPA MA VI JAISHI GAUN,29,46,55,35,44,44,22,22,0,1,16,1,18,4,82
885,OKHALDHUNGA,13024,JALPA MA VI KALIMATI,16,40,12,25,40,39,41,40,0,1,3,0,4,36,10
1425,SINDHUPALCH,23004,JALPA MA VI KOTHE LAMUSANGHU,27,44,44,2,4,39,65,65,0,11,19,0,30,35,46
848,KHOTANG,12045,JALPA MA VI NUNTHALA,2,47,33,3,5,45,45,45,0,0,26,3,29,16,64
883,OKHALDHUNGA,13022,JALPA MA VI TARKERABARI,30,54,39,37,48,44,48,48,0,3,42,0,45,3,94
4650,BAJURA,69017,JALPADEVI MA VI KHETIPATAL JUGADA,18,39,2,30,35,37,9,9,0,0,0,1,1,8,11
346,SANKHUWASAB,5024,JAMBAWATEE MA VI SIBHUWA,28,40,34,30,43,42,16,16,0,0,7,4,11,5,69
4013,MYAGDI,51038,JAMUNAKHARKA MA VI ARTHUNGE-5,33,59,40,44,56,50,30,30,0,9,16,0,25,5,83
3463,SYANGJA,43099,JAMUNE DANDA MA VI BIRUWA ARCHALE,15,40,1,20,27,33,26,26,0,0,1,0,1,25,4
4889,DARCHULA,74022,JAN BIKASH MA VI BARBAJ,15,38,20,16,21,27,37,37,0,0,3,1,4,33,11
1188,SINDHULI,19017,JAN JAGARITI MA VI NIBUWATAR,25,35,48,26,3,35,43,43,0,3,11,5,19,24,44
2642,MAKWANPUR,33042,JAN JAGRITI MA VI CHUREMAI RATOMATE,29,45,48,24,4,39,24,24,0,3,7,3,13,11,54
3899,RUPANDEHI,48116,JAN JAGRITI MA VI JOGIKUTI SHANKAR NAGAR,26,41,25,21,42,36,52,52,0,4,9,0,13,39,25
4322,DANG,58047,JAN JAGRITI MA VI PATU BANAGAUN,20,46,26,23,41,37,51,51,0,2,13,1,16,35,31
4507,SURKHET,66032,JAN JYOTI MA VI BADDICHAUR,38,48,34,32,35,45,22,22,0,1,12,1,14,8,64
3937,KAPILVASTU,49018,JAN KALYAN MA VI BARKULPUR,25,44,26,20,36,44,64,64,0,4,9,0,13,51,20
4015,MYAGDI,51040,JAN KALYAN MA VI PULACHOUR-4,28,43,21,33,42,47,24,24,0,0,5,0,5,19,21
3969,MUSTANG,50002,JANA ADARSHA MA VI KOWANG,3,44,38,24,38,5,4,4,0,0,2,1,3,1,75
187,JHAPA,4033,JANA ADARSHA MA VI SHIVGUNJ,18,41,25,30,40,32,153,152,0,2,25,3,30,121,20
3972,MUSTANG,50005,JANA BAL MA VI MARPHA,30,44,28,24,35,44,4,4,0,1,0,0,1,3,25
4100,PARBAT,53010,JANA BIKAS MA VI PAKHAPANI,19,36,15,32,46,38,36,36,0,1,5,0,6,30,17
2475,LALITPUR,32087,JANA BIKASH MA VI JHARUWARASI,37,53,46,27,44,42,33,33,0,3,26,1,30,3,91
2016,KATHMANDU,29199,JANA BIKASH MA VI MATATIRTHA,38,56,65,35,48,55,38,38,0,16,19,0,35,3,92
574,MORANG,9078,JANA BIKASH MA VI RANI BIRATNAGAR,21,28,12,16,3,21,62,61,0,0,1,1,2,59,3
3683,GULMI,46036,JANA BODH MA VI RANIBAS BAMGHA,29,41,24,22,41,4,138,138,0,3,39,1,43,95,31
1790,BHAKTAPUR,28065,JANA CHETANA ENGLISH SCHOOL BALKOT,60,6,72,59,54,48,16,16,0,14,1,0,15,1,94
3136,KASKI,41039,JANA CHETANA MA VI NIRMAL POKHARI,31,39,23,23,48,37,65,65,0,3,12,2,17,48,26
1665,KAVREPALANC,27049,JANA CHETANA MA VI SARSYUKHARKA,27,45,30,24,35,39,37,37,0,0,14,5,19,18,51
4514,SURKHET,66039,JANA GYAN BHANDAR MA VI KOTKHOLA MALARANI,31,48,28,28,3,41,60,58,0,4,13,3,20,38,34
1338,MAHOTTARI,21028,JANA JAGRIT MA VI PATU,31,46,4,30,39,40,43,43,0,3,28,3,34,9,79
4500,SURKHET,66023,JANA JAGRIT MA VI TOSHRA,25,38,11,13,31,35,13,13,0,0,0,0,0,13,000
4833,KAILALI,73058,JANA JAGRITEE MA VI SITAPUR TIKAPUR,24,42,29,25,41,41,36,35,0,4,3,2,9,26,26
3750,ARGHAKHANCH,47018,JANA JAGRITI MA VI DHANACHOUR,20,29,11,26,41,44,89,89,0,0,4,0,4,85,4
2469,LALITPUR,32081,JANA JAGRITI MA VI EKUDOLE,41,66,54,4,54,52,20,20,0,9,7,0,16,4,80
168,JHAPA,4014,JANA JAGRITI MA VI GOLDHAP,20,41,27,22,4,35,122,122,0,2,15,11,28,94,23
3660,GULMI,46013,JANA JAGRITI MA VI HUNGA,23,38,25,23,33,44,105,105,0,4,22,2,28,77,27
4192,ROLPA,55004,JANA JAGRITI MA VI JUGAR,29,50,26,20,40,36,51,51,0,3,13,1,17,34,33
4026,BAGLUNG,52010,JANA JAGRITI MA VI KANDEBASH,25,43,30,25,43,37,105,105,0,5,23,7,35,70,33
3793,RUPANDEHI,48008,JANA JAGRITI MA VI KARUWANI,24,39,1,23,34,31,45,44,0,0,1,2,3,40,7
4168,RUKUM,54012,JANA JAGRITI MA VI MAHAT,20,30,13,2,38,26,33,30,0,0,0,0,0,30,000
4802,KAILALI,73027,JANA JAGRITI MA VI MOHANLALCHAURI,21,37,27,24,37,38,101,100,0,3,17,2,22,78,22
3508,NAWALPARASI,44040,JANA JAGRITI MA VI PARSAUNI,20,41,33,28,47,5,19,19,0,0,4,1,5,14,26
2699,CHITWAN,34031,JANA JAGRITI MA VI PITHUWA,4,42,57,35,50,48,134,134,0,30,84,0,114,20,85
1427,SINDHUPALCH,23006,JANA JAGRITI MA VI SANGACHOK,30,49,44,28,49,5,95,93,0,6,51,2,59,33,63
3169,KASKI,41072,JANA JAGRITI MA VI SARANGKOT,32,56,36,30,44,5,52,52,0,9,24,0,33,19,63
3755,ARGHAKHANCH,47023,JANA JAGRITI MA VI SIDDHARA,22,37,12,27,42,44,49,49,0,1,3,0,4,45,8
2798,RAUTAHAT,35015,JANA JAGRITI MA VI SINDUREGHARI,29,43,43,31,46,36,73,73,0,3,28,4,35,38,48
3338,TANAHUN,42076,JANA JAGRITI MA VI TURTURE,31,46,4,37,46,48,23,23,0,2,9,0,11,12,48
886,OKHALDHUNGA,13025,JANA JEEVAN MA VI WACHPOO POKALI,29,6,41,36,50,41,46,46,0,9,26,0,35,11,76
2700,CHITWAN,34032,JANA JIWAN MA VI AYODHYAPURI MADI,34,48,55,3,54,41,78,78,0,15,51,1,67,11,86
2702,CHITWAN,34034,JANA JIWAN MA VI CHAINPUR,30,48,47,35,5,50,55,55,0,6,32,1,39,16,71
3297,TANAHUN,42031,JANA JUKTA SHAHI MA VI SANGE,23,42,17,24,4,29,55,55,0,0,7,1,8,47,15
3055,LAMJUNG,40020,JANA JYOTI MA VI BAGLUNG PANI,29,42,10,27,33,42,14,14,0,0,0,0,0,14,000
4334,DANG,58059,JANA JYOTI MA VI BELA DEUKHURI,27,40,21,23,35,33,32,32,0,0,6,3,9,23,28
3285,TANAHUN,42019,JANA JYOTI MA VI BHIMAD,31,50,48,32,49,52,96,96,0,13,56,6,75,21,78
1943,KATHMANDU,29120,JANA JYOTI MA VI BHIMSENSTHAN,54,67,8,46,6,51,24,24,1,18,4,0,23,1,96
4998,KANCHANPUR,77009,JANA JYOTI MA VI CALCUTTA,21,44,31,25,31,44,82,82,0,2,14,3,19,63,23
